{
  "id": 0,
  "status": "example-status",
  "created_at": "2026-04-19T12:00:00Z",
  "updated_at": "2026-04-19T12:00:00Z",
  "title": "example-title",
  "content": "example-content",
  "type": "example-type",
  "creator": "example-creator",
  "bucket": "example-bucket",
  "parent": "example-parent",
  "boosts_count": 0
}